sentence id,sentence,PLL score,nr. of tokens
tensor(727),The custodian was phoned by the gardener.,-54.32191467285156,12
tensor(728),The drummer annoyed the weatherman.,-45.639015197753906,8
tensor(729),The weatherman annoyed the drummer.,-46.2701416015625,8
tensor(730),The weatherman was annoyed by the drummer.,-47.618446350097656,10
tensor(731),The drummer was annoyed by the weatherman.,-49.44824981689453,10
tensor(732),The percussionist displeased the meteorologist.,-52.62635040283203,10
tensor(733),The meteorologist displeased the percussionist.,-57.707763671875,10
tensor(734),The meteorologist was displeased by the percussionist.,-60.908782958984375,12
tensor(735),The percussionist was displeased by the meteorologist.,-61.04954147338867,12
tensor(736),The go-between belittled the defendant.,-55.15781784057617,11
tensor(737),The defendant belittled the go-between.,-51.85013198852539,11
tensor(738),The defendant was belittled by the go-between.,-52.802467346191406,13
tensor(739),The go-between was belittled by the defendant.,-58.398006439208984,13
tensor(740),The intermediary deprecated the felon.,-58.26694107055664,7
tensor(741),The felon deprecated the intermediary.,-59.76624298095703,7
tensor(742),The felon was deprecated by the intermediary.,-58.772308349609375,9
tensor(743),The intermediary was deprecated by the felon.,-61.404869079589844,9
tensor(744),The valet entertained the envoy.,-54.06242370605469,8
tensor(745),The envoy entertained the valet.,-52.95859146118164,8
tensor(746),The envoy was entertained by the valet.,-52.411109924316406,10
tensor(747),The valet was entertained by the envoy.,-52.84762954711914,10
tensor(748),The manservant amused the emissary.,-57.54205322265625,11
tensor(749),The emissary amused the manservant.,-54.78913116455078,11
tensor(750),The emissary was amused by the manservant.,-55.82440185546875,13
tensor(751),The manservant was amused by the emissary.,-58.726173400878906,13
tensor(752),The acrobat pushed the stranger.,-48.5221061706543,8
tensor(753),The stranger pushed the acrobat.,-52.00518035888672,8
tensor(754),The stranger was pushed by the acrobat.,-52.60248565673828,10
tensor(755),The acrobat was pushed by the stranger.,-52.032108306884766,10
tensor(756),The gymnast shoved the outsider.,-53.9311637878418,8
tensor(757),The outsider shoved the gymnast.,-55.612483978271484,8
tensor(758),The outsider was shoved by the gymnast.,-55.337913513183594,10
tensor(759),The gymnast was shoved by the outsider.,-55.88063430786133,10
tensor(760),The benefactor calmed the architect.,-55.34709930419922,8
tensor(761),The architect calmed the benefactor.,-56.84183120727539,8
tensor(762),The architect was calmed by the benefactor.,-57.270328521728516,10
tensor(763),The benefactor was calmed by the architect.,-55.62727355957031,10
tensor(764),The patron soothed the draftsman.,-54.54468536376953,10
tensor(765),The draftsman soothed the patron.,-60.81373596191406,10
tensor(766),The draftsman was soothed by the patron.,-62.930259704589844,12
tensor(767),The patron was soothed by the draftsman.,-56.68043518066406,12
tensor(768),The therapist lauded the hairdresser.,-49.54092025756836,10
tensor(769),The hairdresser lauded the therapist.,-51.19322204589844,10
tensor(770),The hairdresser was lauded by the therapist.,-51.43327331542969,12
tensor(771),The therapist was lauded by the hairdresser.,-51.18058776855469,12
tensor(772),The psychologist extolled the hairstylist.,-54.2325439453125,11
tensor(773),The hairstylist extolled the psychologist.,-55.33057403564453,11
tensor(774),The hairstylist was extolled by the psychologist.,-56.21831512451172,13
tensor(775),The psychologist was extolled by the hairstylist.,-56.04769515991211,13
tensor(776),The nobleman married the baroness.,-48.04034423828125,10
tensor(777),The baroness married the nobleman.,-45.55744171142578,10
tensor(778),The baroness was married by the nobleman.,-51.517616271972656,12
tensor(779),The nobleman was married by the baroness.,-53.839332580566406,12
tensor(780),The aristocrat wed the countess.,-49.10100173950195,9
tensor(781),The countess wed the aristocrat.,-56.79695129394531,9
tensor(782),The countess was wed by the aristocrat.,-56.61797332763672,11
tensor(783),The aristocrat was wed by the countess.,-55.036956787109375,11
tensor(784),The actuary assuaged the creditor.,-58.90034484863281,10
tensor(785),The creditor assuaged the actuary.,-61.481143951416016,10
tensor(786),The creditor was assuaged by the actuary.,-55.83636474609375,12
tensor(787),The actuary was assuaged by the creditor.,-61.00459289550781,12
tensor(788),The analyst relieved the investor.,-48.949275970458984,7
tensor(789),The investor relieved the analyst.,-52.305763244628906,7
tensor(790),The investor was relieved by the analyst.,-52.738101959228516,9
tensor(791),The analyst was relieved by the investor.,-51.088111877441406,9
tensor(792),The sailor frightened the psychic.,-49.43408966064453,7
tensor(793),The psychic frightened the sailor.,-46.69648742675781,7
tensor(794),The psychic was frightened by the sailor.,-50.4713020324707,9
tensor(795),The sailor was frightened by the psychic.,-51.12965393066406,9
tensor(796),The mariner scared the fortune-teller.,-54.47694396972656,11
tensor(797),The fortune-teller scared the mariner.,-52.20298385620117,11
tensor(798),The fortune-teller was scared by the mariner.,-57.756744384765625,13
tensor(799),The mariner was scared by the fortune-teller.,-56.22396469116211,13
tensor(800),The assistant flattered the auditor.,-54.02219772338867,8
tensor(801),The auditor flattered the assistant.,-50.8355712890625,8
tensor(802),The auditor was flattered by the assistant.,-53.58430862426758,10
tensor(803),The assistant was flattered by the auditor.,-52.648681640625,10
tensor(804),The helper complimented the appraiser.,-54.91999053955078,9
tensor(805),The appraiser complimented the helper.,-49.82815933227539,9
tensor(806),The appraiser was complimented by the helper.,-52.90741729736328,11
tensor(807),The helper was complimented by the appraiser.,-54.19306182861328,11
tensor(808),The immigrant believed the trooper.,-56.551795959472656,7
tensor(809),The trooper believed the immigrant.,-53.507328033447266,7
tensor(810),The trooper was believed by the immigrant.,-60.52426528930664,9
tensor(811),The immigrant was believed by the trooper.,-58.75080108642578,9
tensor(812),The foreigner trusted the patrolman.,-51.559593200683594,8
tensor(813),The patrolman trusted the foreigner.,-50.18254089355469,8
tensor(814),The patrolman was trusted by the foreigner.,-52.79853820800781,10
tensor(815),The foreigner was trusted by the patrolman.,-54.41234588623047,10
tensor(816),The mapmaker affronted the farmer.,-56.34554672241211,10
tensor(817),The farmer affronted the mapmaker.,-56.468772888183594,10
tensor(818),The farmer was affronted by the mapmaker.,-56.31459045410156,12
tensor(819),The mapmaker was affronted by the farmer.,-57.097740173339844,12
tensor(820),The cartographer insulted the rancher.,-50.203163146972656,9
tensor(821),The rancher insulted the cartographer.,-50.089237213134766,9
tensor(822),The rancher was insulted by the cartographer.,-51.683998107910156,11
tensor(823),The cartographer was insulted by the rancher.,-51.23858642578125,11
tensor(824),The poet awed the entertainer.,-55.72471237182617,9
tensor(825),The entertainer awed the poet.,-52.978111267089844,9
tensor(826),The entertainer was awed by the poet.,-53.547264099121094,11
tensor(827),The poet was awed by the entertainer.,-52.791099548339844,11
tensor(828),The lyricist dazzled the performer.,-52.749900817871094,9
tensor(829),The performer dazzled the lyricist.,-54.127723693847656,9
tensor(830),The performer was dazzled by the lyricist.,-54.705875396728516,11
tensor(831),The lyricist was dazzled by the performer.,-51.18694305419922,11
tensor(832),The peddler tested the manager.,-49.121639251708984,8
tensor(833),The manager tested the peddler.,-47.622337341308594,8
tensor(834),The manager was tested by the peddler.,-50.869285583496094,10
tensor(835),The peddler was tested by the manager.,-50.40766906738281,10
tensor(836),The traveling salesman challenged the executive.,-48.37608337402344,8
tensor(837),The executive challenged the traveling salesman.,-52.990272521972656,8
tensor(838),The executive was challenged by the traveling salesman.,-53.44218444824219,10
tensor(839),The traveling salesman was challenged by the executive.,-50.65547180175781,10
tensor(840),The musician admired the diva.,-47.856910705566406,8
tensor(841),The diva admired the musician.,-52.12333679199219,8
tensor(842),The diva was admired by the musician.,-54.22910690307617,10
tensor(843),The musician was admired by the diva.,-50.612823486328125,10
tensor(844),The instrumentalist adored the prima donna.,-60.41877746582031,12
tensor(845),The prima donna adored the instrumentalist.,-60.33570861816406,12
tensor(846),The prima donna was adored by the instrumentalist.,-61.043212890625,14
tensor(847),The instrumentalist was adored by the prima donna.,-59.900535583496094,14
tensor(848),The general welcomed the hero.,-44.61005401611328,7
tensor(849),The hero welcomed the general.,-43.96446228027344,7
tensor(850),The hero was welcomed by the general.,-45.136966705322266,9
tensor(851),The general was welcomed by the hero.,-47.20561218261719,9
tensor(852),The commander greeted the champion.,-45.752601623535156,7
tensor(853),The champion greeted the commander.,-49.0155143737793,7
tensor(854),The champion was greeted by the commander.,-49.020816802978516,9
tensor(855),The commander was greeted by the champion.,-48.236961364746094,9
tensor(856),The cobbler disdained the stonecutter.,-58.68196105957031,13
tensor(857),The stonecutter disdained the cobbler.,-58.22130584716797,13
tensor(858),The stonecutter was disdained by the cobbler.,-60.970481872558594,15
tensor(859),The cobbler was disdained by the stonecutter.,-64.0453109741211,15
tensor(860),The shoemaker scorned the mason.,-58.979705810546875,10
tensor(861),The mason scorned the shoemaker.,-65.29710388183594,10
tensor(862),The mason was scorned by the shoemaker.,-60.55371856689453,12
tensor(863),The shoemaker was scorned by the mason.,-60.86221694946289,12
tensor(864),The postman noticed the chaplain.,-50.2843017578125,9
tensor(865),The chaplain noticed the postman.,-50.54901123046875,9
tensor(866),The chaplain was noticed by the postman.,-49.52381896972656,11
tensor(867),The postman was noticed by the chaplain.,-50.647377014160156,11
tensor(868),The mailman saw the minister.,-47.024715423583984,8
tensor(869),The minister saw the mailman.,-44.75202941894531,8
tensor(870),The minister was seen by the mailman.,-51.665225982666016,10
tensor(871),The mailman was seen by the minister.,-48.91685485839844,10
tensor(872),The composer begrudged the playwright.,-49.79515838623047,11
tensor(873),The playwright begrudged the composer.,-50.70564270019531,11
tensor(874),The playwright was begrudged by the composer.,-56.51744079589844,13
tensor(875),The composer was begrudged by the playwright.,-54.525733947753906,13
tensor(876),The songwriter envied the dramatist.,-53.48134994506836,11
tensor(877),The dramatist envied the songwriter.,-54.48041915893555,11
tensor(878),The dramatist was envied by the songwriter.,-56.95964813232422,13
tensor(879),The songwriter was envied by the dramatist.,-57.99736404418945,13
tensor(880),The missionary baffled the oracle.,-51.47249984741211,8
tensor(881),The oracle baffled the missionary.,-50.07310104370117,8
tensor(882),The oracle was baffled by the missionary.,-51.65925216674805,10
tensor(883),The missionary was baffled by the oracle.,-52.0618782043457,10
tensor(884),The evangelist mystified the soothsayer.,-53.63548278808594,11
tensor(885),The soothsayer mystified the evangelist.,-52.07538604736328,11
tensor(886),The soothsayer was mystified by the evangelist.,-55.074623107910156,13
tensor(887),The evangelist was mystified by the soothsayer.,-53.01069641113281,13
tensor(888),The trespasser choked the fighter.,-49.33177185058594,8
tensor(889),The fighter choked the trespasser.,-54.631900787353516,8
tensor(890),The fighter was choked by the trespasser.,-54.20226287841797,10
tensor(891),The trespasser was choked by the fighter.,-51.55287551879883,10
tensor(892),The broker introduced the donor.,-45.22138214111328,7
tensor(893),The donor introduced the broker.,-47.75299835205078,7
tensor(894),The donor was introduced by the broker.,-48.398284912109375,9
tensor(895),The broker was introduced by the donor.,-48.41722869873047,9
tensor(896),The dealer presented the sponsor.,-45.06050491333008,7
tensor(897),The sponsor presented the dealer.,-47.937347412109375,7
tensor(898),The sponsor was presented by the dealer.,-47.42181396484375,9
tensor(899),The dealer was presented by the sponsor.,-48.74260711669922,9
tensor(900),The shrink commended the dean.,-51.607975006103516,8
tensor(901),The dean commended the shrink.,-50.30093002319336,8
tensor(902),The dean was commended by the shrink.,-50.986812591552734,10
tensor(903),The shrink was commended by the dean.,-51.92045211791992,10
tensor(904),The psychiatrist applauded the provost.,-52.50168228149414,8
tensor(905),The provost applauded the psychiatrist.,-50.94609451293945,8
tensor(906),The provost was applauded by the psychiatrist.,-55.38237380981445,10
tensor(907),The psychiatrist was applauded by the provost.,-52.03493118286133,10
tensor(908),The refugee provoked the homeless person.,-52.416595458984375,8
tensor(909),The homeless person provoked the refugee.,-47.1866340637207,8
tensor(910),The homeless person was provoked by the refugee.,-48.826866149902344,10
tensor(911),The refugee was provoked by the homeless person.,-51.87409591674805,10
tensor(912),The asylum seeker goaded the vagrant.,-57.425636291503906,10
tensor(913),The vagrant goaded the asylum seeker.,-55.16160583496094,10
tensor(914),The vagrant was goaded by the asylum seeker.,-57.79159164428711,12
tensor(915),The asylum seeker was goaded by the vagrant.,-59.566261291503906,12
tensor(916),The interpreter swindled the messenger.,-51.31723403930664,9
tensor(917),The messenger swindled the interpreter.,-52.759666442871094,9
tensor(918),The messenger was swindled by the interpreter.,-54.15217590332031,11
tensor(919),The interpreter was swindled by the messenger.,-54.04210662841797,11
tensor(920),The translator deceived the courier.,-47.18421173095703,7
tensor(921),The courier deceived the translator.,-46.07411575317383,7
tensor(922),The courier was deceived by the translator.,-46.9414176940918,9
tensor(923),The translator was deceived by the courier.,-48.66944885253906,9
tensor(924),The gangster hated the governor.,-45.08942413330078,8
tensor(925),The governor hated the gangster.,-44.57801055908203,8
tensor(926),The governor was hated by the gangster.,-50.072837829589844,10
tensor(927),The gangster was hated by the governor.,-48.710845947265625,10
tensor(928),The hoodlum abhorred the chancellor.,-55.46009063720703,10
tensor(929),The chancellor abhorred the hoodlum.,-55.36833953857422,10
tensor(930),The chancellor was abhorred by the hoodlum.,-60.2374153137207,12
tensor(931),The hoodlum was abhorred by the chancellor.,-59.81389617919922,12
tensor(932),The planner convinced the customer.,-45.128021240234375,7
tensor(933),The customer convinced the planner.,-47.40788269042969,7
tensor(934),The customer was convinced by the planner.,-48.00609588623047,9
tensor(935),The planner was convinced by the customer.,-47.909454345703125,9
tensor(936),The organizer persuaded the buyer.,-45.440582275390625,7
tensor(937),The buyer persuaded the organizer.,-46.70659637451172,7
tensor(938),The buyer was persuaded by the organizer.,-49.400299072265625,9
tensor(939),The organizer was persuaded by the buyer.,-48.647220611572266,9
tensor(940),The wizard protected the gnome.,-43.97803497314453,8
tensor(941),The gnome protected the wizard.,-44.19525146484375,8
tensor(942),The gnome was protected by the wizard.,-44.5306282043457,10
tensor(943),The wizard was protected by the gnome.,-45.466487884521484,10
tensor(944),The sorcerer defended the dwarf.,-46.53178024291992,7
tensor(945),The dwarf defended the sorcerer.,-46.58824157714844,7
tensor(946),The dwarf was defended by the sorcerer.,-48.34718322753906,9
tensor(947),The sorcerer was defended by the dwarf.,-48.06043243408203,9
tensor(948),The student befuddled the professor.,-43.28475570678711,9
tensor(949),The professor befuddled the student.,-40.47690963745117,9
tensor(950),The professor was befuddled by the student.,-42.64752197265625,11
tensor(951),The student was befuddled by the professor.,-45.516685485839844,11
tensor(952),The scholar confused the lecturer.,-46.500640869140625,7
tensor(953),The lecturer confused the scholar.,-47.06626510620117,7
tensor(954),The lecturer was confused by the scholar.,-49.43740463256836,9
tensor(955),The scholar was confused by the lecturer.,-47.916847229003906,9
tensor(956),The invader spotted the sentry.,-44.913780212402344,9
tensor(957),The sentry spotted the invader.,-45.635963439941406,9
tensor(958),The sentry was spotted by the invader.,-48.41997528076172,11
tensor(959),The invader was spotted by the sentry.,-47.49840545654297,11
tensor(960),The intruder sighted the watchman.,-48.814640045166016,9
tensor(961),The watchman sighted the intruder.,-47.906944274902344,9
tensor(962),The watchman was sighted by the intruder.,-51.170135498046875,11
tensor(963),The intruder was sighted by the watchman.,-49.063785552978516,11
tensor(964),The supplier reimbursed the merchant.,-44.880558013916016,8
tensor(965),The merchant reimbursed the supplier.,-44.59959030151367,8
tensor(966),The merchant was reimbursed by the supplier.,-46.145694732666016,10
tensor(967),The supplier was reimbursed by the merchant.,-45.81257629394531,10
tensor(968),The wholesaler compensated the trader.,-53.71612548828125,8
tensor(969),The trader compensated the wholesaler.,-50.03444290161133,8
tensor(970),The trader was compensated by the wholesaler.,-49.74900436401367,10
tensor(971),The wholesaler was compensated by the trader.,-54.62784194946289,10
tensor(972),The accuser confronted the vandal.,-47.488101959228516,7
tensor(973),The vandal confronted the accuser.,-43.40568923950195,7
tensor(974),The vandal was confronted by the accuser.,-45.65596389770508,9
tensor(975),The accuser was confronted by the vandal.,-47.657772064208984,9
tensor(976),The plaintiff accosted the thug.,-51.19770050048828,9
tensor(977),The thug accosted the plaintiff.,-50.79161071777344,9
tensor(978),The thug was accosted by the plaintiff.,-51.696022033691406,11
tensor(979),The plaintiff was accosted by the thug.,-47.69441223144531,11
tensor(980),The trickster bemused the idiot.,-52.50825119018555,10
tensor(981),The idiot bemused the trickster.,-53.907928466796875,10
tensor(982),The idiot was bemused by the trickster.,-51.59466552734375,12
tensor(983),The trickster was bemused by the idiot.,-54.483360290527344,12
tensor(984),The swindler puzzled the fool.,-52.18885803222656,9
tensor(985),The fool puzzled the swindler.,-53.524925231933594,9
tensor(986),The fool was puzzled by the swindler.,-52.93171691894531,11
tensor(987),The swindler was puzzled by the fool.,-55.285850524902344,11
tensor(988),The protestor quoted the leader.,-47.09761428833008,8
tensor(989),The leader quoted the protestor.,-48.219146728515625,8
tensor(990),The leader was quoted by the protestor.,-48.9748420715332,10
tensor(991),The protestor was quoted by the leader.,-49.06230545043945,10
tensor(992),The striker cited the chief.,-53.36555099487305,7
tensor(993),The chief cited the striker.,-51.33049392700195,7
tensor(994),The chief was cited by the striker.,-50.95461654663086,9
tensor(995),The striker was cited by the chief.,-51.053619384765625,9
tensor(996),The postal worker repulsed the taxi-driver.,-60.21235275268555,12
tensor(997),The taxi-driver repulsed the postal worker.,-55.99443435668945,12
tensor(998),The taxi-driver was repulsed by the postal worker.,-56.79484558105469,14
tensor(999),The postal worker was repulsed by the taxi-driver.,-59.866065979003906,14
tensor(1000),The letter carrier disgusted the cabbie.,-55.16919708251953,10
tensor(1001),The cabbie disgusted the letter carrier.,-51.87261962890625,10
tensor(1002),The cabbie was disgusted by the letter carrier.,-55.16413879394531,12
tensor(1003),The letter carrier was disgusted by the cabbie.,-55.965518951416016,12
tensor(1004),The competitor agitated the rival.,-52.57625961303711,7
tensor(1005),The rival agitated the competitor.,-53.27342987060547,7
tensor(1006),The rival was agitated by the competitor.,-54.52165603637695,9
tensor(1007),The competitor was agitated by the rival.,-53.7326545715332,9
tensor(1008),The contender flustered the opponent.,-50.67767333984375,9
tensor(1009),The opponent flustered the contender.,-52.773284912109375,9
tensor(1010),The opponent was flustered by the contender.,-52.435508728027344,11
tensor(1011),The contender was flustered by the opponent.,-51.45966720581055,11
tensor(1012),The culprit betrayed the hunter.,-46.362213134765625,7
tensor(1013),The hunter betrayed the culprit.,-45.11888122558594,7
tensor(1014),The hunter was betrayed by the culprit.,-46.992637634277344,9
tensor(1015),The culprit was betrayed by the hunter.,-47.62057876586914,9
tensor(1016),The botanist respected the partner.,-54.378780364990234,9
tensor(1017),The partner respected the botanist.,-56.65105438232422,9
tensor(1018),The partner was respected by the botanist.,-56.94710922241211,11
tensor(1019),The botanist was respected by the partner.,-58.00954055786133,11
tensor(1020),The flora specialist esteemed the collaborator.,-65.80853271484375,8
tensor(1021),The collaborator esteemed the flora specialist.,-67.53977966308594,8
tensor(1022),The collaborator was esteemed by the flora specialist.,-68.67581176757812,10
tensor(1023),The flora specialist was esteemed by the collaborator.,-69.27738189697266,10
tensor(1024),The pacifist placated the zealot.,-55.519134521484375,10
tensor(1025),The zealot placated the pacifist.,-54.74222946166992,10
tensor(1026),The zealot was placated by the pacifist.,-52.680137634277344,12
tensor(1027),The pacifist was placated by the zealot.,-53.037452697753906,12
tensor(1028),The scoundrel beat the protagonist.,-44.719913482666016,9
tensor(1029),The protagonist beat the scoundrel.,-42.17930221557617,9
tensor(1030),The protagonist was beaten by the scoundrel.,-45.12677001953125,11
tensor(1031),The scoundrel was beaten by the protagonist.,-47.674346923828125,11
tensor(1032),The rogue defeated the main character.,-43.586734771728516,8
tensor(1033),The main character defeated the rogue.,-43.92781448364258,8
tensor(1034),The main character was defeated by the rogue.,-43.475093841552734,10
tensor(1035),The rogue was defeated by the main character.,-44.58714294433594,10
tensor(1036),The sociologist accepted the offer.,-43.85247802734375,8
tensor(1037),The offer accepted the sociologist.,-56.921485900878906,8
tensor(1038),The offer was accepted by the sociologist.,-47.06481170654297,10
tensor(1039),The sociologist was accepted by the offer.,-57.81291198730469,10
tensor(1040),The boyfriend basted the turkey.,-46.15045166015625,8
tensor(1041),The turkey basted the boyfriend.,-48.118804931640625,8
tensor(1042),The turkey was basted by the boyfriend.,-50.85513687133789,10
tensor(1043),The boyfriend was basted by the turkey.,-54.174415588378906,10
tensor(1044),The caseworker posed the question.,-44.32096862792969,9
tensor(1045),The question posed the caseworker.,-49.9019775390625,9
tensor(1046),The question was posed by the caseworker.,-43.75038146972656,11
tensor(1047),The caseworker was posed by the question.,-55.432334899902344,11
tensor(1048),The ditch digger bent the wire.,-47.82917022705078,9
tensor(1049),The wire bent the ditch digger.,-53.589630126953125,9
tensor(1050),The wire was bent by the ditch digger.,-47.445640563964844,11
tensor(1051),The ditch digger was bent by the wire.,-53.47654342651367,11
tensor(1052),The uncle hung the ornament.,-46.59886169433594,7
tensor(1053),The ornament hung the uncle.,-57.5131721496582,7
tensor(1054),The ornament was hung by the uncle.,-52.57754135131836,9
tensor(1055),The uncle was hung by the ornament.,-51.886383056640625,9
tensor(1056),The attendant pressed the button.,-35.23509216308594,7
tensor(1057),The button pressed the attendant.,-48.40488815307617,7
tensor(1058),The button was pressed by the attendant.,-44.63966751098633,9
tensor(1059),The attendant was pressed by the button.,-49.0968017578125,9
tensor(1060),The bum stole the necklace.,-38.79155731201172,7
tensor(1061),The necklace stole the bum.,-43.809696197509766,7
tensor(1062),The necklace was stolen by the bum.,-42.57518005371094,9
tensor(1063),The bum was stolen by the necklace.,-50.72499084472656,9
tensor(1064),The potter molded the clay.,-51.166114807128906,8
tensor(1065),The clay molded the potter.,-53.405296325683594,8
tensor(1066),The clay was molded by the potter.,-47.81058120727539,10
tensor(1067),The potter was molded by the clay.,-49.77442169189453,10
tensor(1068),The guarantor initialed the form.,-53.548912048339844,9
tensor(1069),The form initialed the guarantor.,-59.27367401123047,9
tensor(1070),The form was initialed by the guarantor.,-55.74388885498047,11
tensor(1071),The guarantor was initialed by the form.,-59.55064010620117,11
tensor(1072),The couch-potato forgot the umbrella.,-54.796119689941406,10
tensor(1073),The umbrella forgot the couch-potato.,-57.581764221191406,10
tensor(1074),The umbrella was forgotten by the couch-potato.,-59.148529052734375,12
tensor(1075),The couch-potato was forgotten by the umbrella.,-64.33796691894531,12
tensor(1076),The groupie attended the concert.,-46.852012634277344,8
tensor(1077),The concert attended the groupie.,-56.89616775512695,8
tensor(1078),The concert was attended by the groupie.,-54.980995178222656,10
tensor(1079),The groupie was attended by the concert.,-57.296730041503906,10
