sentence id,sentence,PLL score,nr. of tokens
tensor(368),The fairy enchanted the troll.,-45.093955993652344,7
tensor(369),The troll enchanted the fairy.,-49.37602233886719,7
tensor(370),The troll was enchanted by the fairy.,-46.222042083740234,9
tensor(371),The fairy was enchanted by the troll.,-46.31224822998047,9
tensor(372),The pixie mesmerized the ogre.,-53.277687072753906,9
tensor(373),The ogre mesmerized the pixie.,-56.27532196044922,9
tensor(374),The ogre was mesmerized by the pixie.,-52.46392822265625,11
tensor(375),The pixie was mesmerized by the ogre.,-54.92824172973633,11
tensor(376),The orderly assisted the dentist.,-53.694679260253906,7
tensor(377),The dentist assisted the orderly.,-48.50560760498047,7
tensor(378),The dentist was assisted by the orderly.,-50.146156311035156,9
tensor(379),The orderly was assisted by the dentist.,-52.82567596435547,9
tensor(380),The nurse helped the orthodontist.,-44.34027862548828,10
tensor(381),The orthodontist helped the nurse.,-45.17839050292969,10
tensor(382),The orthodontist was helped by the nurse.,-46.47480010986328,12
tensor(383),The nurse was helped by the orthodontist.,-47.228981018066406,12
tensor(384),The owner evicted the tenant.,-36.67055892944336,8
tensor(385),The tenant evicted the owner.,-42.401432037353516,8
tensor(386),The tenant was evicted by the owner.,-40.928382873535156,10
tensor(387),The owner was evicted by the tenant.,-37.99576187133789,10
tensor(388),The critic attacked the conservative.,-45.050113677978516,7
tensor(389),The conservative attacked the critic.,-45.622276306152344,7
tensor(390),The conservative was attacked by the critic.,-48.16172409057617,9
tensor(391),The critic was attacked by the conservative.,-47.0604133605957,9
tensor(392),The reviewer criticized the right-winger.,-50.642051696777344,10
tensor(393),The right-winger criticized the reviewer.,-52.430213928222656,10
tensor(394),The right-winger was criticized by the reviewer.,-55.48858642578125,12
tensor(395),The reviewer was criticized by the right-winger.,-54.66375732421875,12
tensor(396),The admirer badgered the director.,-56.35609436035156,9
tensor(397),The director badgered the admirer.,-56.037452697753906,9
tensor(398),The director was badgered by the admirer.,-58.32352066040039,11
tensor(399),The admirer was badgered by the director.,-56.50490188598633,11
tensor(400),The fan pestered the filmmaker.,-51.433570861816406,8
tensor(401),The filmmaker pestered the fan.,-51.92434310913086,8
tensor(402),The filmmaker was pestered by the fan.,-53.61407470703125,10
tensor(403),The fan was pestered by the filmmaker.,-53.066226959228516,10
tensor(404),The paramedic revived the youth.,-44.27756118774414,8
tensor(405),The youth revived the paramedic.,-51.24882507324219,8
tensor(406),The youth was revived by the paramedic.,-51.63185119628906,10
tensor(407),The paramedic was revived by the youth.,-49.02684020996094,10
tensor(408),The EMT resuscitated the youngster.,-50.28372573852539,9
tensor(409),The youngster resuscitated the EMT.,-54.09209442138672,9
tensor(410),The youngster was resuscitated by the EMT.,-51.54549789428711,11
tensor(411),The EMT was resuscitated by the youngster.,-56.083587646484375,11
tensor(412),The prankster duped the marketer.,-49.874942779541016,10
tensor(413),The marketer duped the prankster.,-50.92529296875,10
tensor(414),The marketer was duped by the prankster.,-50.2591667175293,12
tensor(415),The prankster was duped by the marketer.,-51.59392166137695,12
tensor(416),The joker tricked the distributor.,-48.61921310424805,8
tensor(417),The distributor tricked the joker.,-48.15556716918945,8
tensor(418),The distributor was tricked by the joker.,-48.633270263671875,10
tensor(419),The joker was tricked by the distributor.,-51.05887985229492,10
tensor(420),The playboy courted the damsel.,-52.452152252197266,10
tensor(421),The damsel courted the playboy.,-51.87759017944336,10
tensor(422),The damsel was courted by the playboy.,-55.14170455932617,12
tensor(423),The playboy was courted by the damsel.,-60.08477020263672,12
tensor(424),The womanizer wooed the maiden.,-58.275970458984375,9
tensor(425),The maiden wooed the womanizer.,-57.7266845703125,9
tensor(426),The maiden was wooed by the womanizer.,-55.6310920715332,11
tensor(427),The womanizer was wooed by the maiden.,-60.72056579589844,11
tensor(428),The nomad cherished the clergyman.,-58.952178955078125,9
tensor(429),The clergyman cherished the nomad.,-57.23122024536133,9
tensor(430),The clergyman was cherished by the nomad.,-59.72621154785156,11
tensor(431),The nomad was cherished by the clergyman.,-58.93803405761719,11
tensor(432),The vagabond revered the priest.,-49.131248474121094,9
tensor(433),The priest revered the vagabond.,-47.608890533447266,9
tensor(434),The priest was revered by the vagabond.,-49.4891357421875,11
tensor(435),The vagabond was revered by the priest.,-51.65093994140625,11
tensor(436),The assassin shot the statesman.,-46.53077697753906,8
tensor(437),The statesman shot the assassin.,-45.42280960083008,8
tensor(438),The statesman was shot by the assassin.,-45.814109802246094,10
tensor(439),The assassin was shot by the statesman.,-49.81598663330078,10
tensor(440),The hit man killed the politician.,-44.88054275512695,8
tensor(441),The politician killed the hit man.,-43.718658447265625,8
tensor(442),The politician was killed by the hit man.,-44.67646026611328,10
tensor(443),The hit man was killed by the politician.,-44.86257553100586,10
tensor(444),The clerk charged the elderly person.,-48.60879898071289,8
tensor(445),The elderly person charged the clerk.,-53.167903900146484,8
tensor(446),The elderly person was charged by the clerk.,-49.0544548034668,10
tensor(447),The clerk was charged by the elderly person.,-52.5103645324707,10
tensor(448),The cashier billed the senior citizen.,-50.80323791503906,9
tensor(449),The senior citizen billed the cashier.,-52.04865646362305,9
tensor(450),The senior citizen was billed by the cashier.,-51.973838806152344,11
tensor(451),The cashier was billed by the senior citizen.,-53.587154388427734,11
tensor(452),The mediator rescued the hostage.,-43.80855941772461,8
tensor(453),The hostage rescued the mediator.,-50.319419860839844,8
tensor(454),The hostage was rescued by the mediator.,-47.172996520996094,10
tensor(455),The mediator was rescued by the hostage.,-46.907283782958984,10
tensor(456),The negotiator saved the captive.,-46.582454681396484,7
tensor(457),The captive saved the negotiator.,-50.24128723144531,7
tensor(458),The captive was saved by the negotiator.,-49.800758361816406,9
tensor(459),The negotiator was saved by the captive.,-50.30952072143555,9
tensor(460),The detective found the assailant.,-40.051631927490234,7
tensor(461),The assailant found the detective.,-43.7854118347168,7
tensor(462),The assailant was found by the detective.,-43.186195373535156,9
tensor(463),The detective was found by the assailant.,-45.30845642089844,9
tensor(464),The sleuth located the attacker.,-47.57001876831055,8
tensor(465),The attacker located the sleuth.,-49.13825988769531,8
tensor(466),The attacker was located by the sleuth.,-48.16374588012695,10
tensor(467),The sleuth was located by the attacker.,-51.15542221069336,10
tensor(468),The artisan trained the apprentice.,-47.70939636230469,7
tensor(469),The apprentice trained the artisan.,-47.77732467651367,7
tensor(470),The apprentice was trained by the artisan.,-48.75762176513672,9
tensor(471),The artisan was trained by the apprentice.,-47.33090591430664,9
tensor(472),The craftsman taught the trainee.,-47.13223648071289,9
tensor(473),The trainee taught the craftsman.,-46.808963775634766,9
tensor(474),The trainee was taught by the craftsman.,-50.30881118774414,11
tensor(475),The craftsman was taught by the trainee.,-48.22297286987305,11
tensor(476),The biker defied the trainer.,-50.840728759765625,8
tensor(477),The trainer defied the biker.,-51.09177017211914,8
tensor(478),The trainer was defied by the biker.,-51.40543746948242,10
tensor(479),The biker was defied by the trainer.,-52.04832077026367,10
tensor(480),The cyclist disobeyed the coach.,-46.05738830566406,8
tensor(481),The coach disobeyed the cyclist.,-47.959083557128906,8
tensor(482),The coach was disobeyed by the cyclist.,-52.76752471923828,10
tensor(483),The cyclist was disobeyed by the coach.,-49.80120086669922,10
tensor(484),The speaker engrossed the audience.,-44.2981071472168,9
tensor(485),The audience engrossed the speaker.,-48.99077606201172,9
tensor(486),The audience was engrossed by the speaker.,-46.09113693237305,11
tensor(487),The speaker was engrossed by the audience.,-46.035728454589844,11
tensor(488),The genius shocked the cousin.,-51.7143669128418,7
tensor(489),The cousin shocked the genius.,-49.1926155090332,7
tensor(490),The cousin was shocked by the genius.,-49.17185974121094,9
tensor(491),The genius was shocked by the cousin.,-54.02690505981445,9
tensor(492),The prodigy surprised the relative.,-57.19111251831055,8
tensor(493),The relative surprised the prodigy.,-54.78760528564453,8
tensor(494),The relative was surprised by the prodigy.,-53.56199264526367,10
tensor(495),The prodigy was surprised by the relative.,-56.72021484375,10
tensor(496),The smuggler bribed the bureaucrat.,-47.46303176879883,10
tensor(497),The bureaucrat bribed the smuggler.,-48.61225128173828,10
tensor(498),The bureaucrat was bribed by the smuggler.,-49.91545486450195,12
tensor(499),The smuggler was bribed by the bureaucrat.,-48.22270584106445,12
tensor(500),The amateur irked the maestro.,-55.37981414794922,9
tensor(501),The maestro irked the amateur.,-56.9154167175293,9
tensor(502),The maestro was irked by the amateur.,-56.78630447387695,11
tensor(503),The amateur was irked by the maestro.,-58.61996078491211,11
tensor(504),The novice irritated the virtuoso.,-53.917144775390625,9
tensor(505),The virtuoso irritated the novice.,-52.66660690307617,9
tensor(506),The virtuoso was irritated by the novice.,-55.06592559814453,11
tensor(507),The novice was irritated by the virtuoso.,-55.423274993896484,11
tensor(508),The lawyer questioned the witness.,-40.870216369628906,7
tensor(509),The witness questioned the lawyer.,-42.509246826171875,7
tensor(510),The witness was questioned by the lawyer.,-42.44038009643555,9
tensor(511),The lawyer was questioned by the witness.,-42.11048126220703,9
tensor(512),The attorney interrogated the bystander.,-48.758522033691406,8
tensor(513),The bystander interrogated the attorney.,-54.853355407714844,8
tensor(514),The bystander was interrogated by the attorney.,-51.67071533203125,10
tensor(515),The attorney was interrogated by the bystander.,-50.30364990234375,10
tensor(516),The singer disappointed the enthusiast.,-46.434730529785156,7
tensor(517),The enthusiast disappointed the singer.,-52.240379333496094,7
tensor(518),The enthusiast was disappointed by the singer.,-51.52461624145508,9
tensor(519),The singer was disappointed by the enthusiast.,-52.09531784057617,9
tensor(520),The vocalist disillusioned the connoisseur.,-56.16045379638672,12
tensor(521),The connoisseur disillusioned the vocalist.,-58.646705627441406,12
tensor(522),The connoisseur was disillusioned by the vocalist.,-57.04479217529297,14
tensor(523),The vocalist was disillusioned by the connoisseur.,-57.635040283203125,14
tensor(524),The chauffeur drove the diplomat.,-45.932342529296875,9
tensor(525),The diplomat drove the chauffeur.,-46.70823669433594,9
tensor(526),The diplomat was driven by the chauffeur.,-49.3948974609375,11
tensor(527),The chauffeur was driven by the diplomat.,-48.54298400878906,11
tensor(528),The driver transported the ambassador.,-45.88554763793945,7
tensor(529),The ambassador transported the driver.,-47.02245330810547,7
tensor(530),The ambassador was transported by the driver.,-48.17277145385742,9
tensor(531),The driver was transported by the ambassador.,-50.25544738769531,9
tensor(532),The guard apprehended the prisoner.,-41.079402923583984,7
tensor(533),The prisoner apprehended the guard.,-47.70551300048828,7
tensor(534),The prisoner was apprehended by the guard.,-42.21744155883789,9
tensor(535),The guard was apprehended by the prisoner.,-46.37844467163086,9
tensor(536),The warden caught the inmate.,-45.39190673828125,8
tensor(537),The inmate caught the warden.,-49.96116256713867,8
tensor(538),The inmate was caught by the warden.,-44.98459243774414,10
tensor(539),The warden was caught by the inmate.,-48.53584671020508,10
tensor(540),The tailor costumed the dancer.,-54.03860855102539,8
tensor(541),The dancer costumed the tailor.,-51.14202880859375,8
tensor(542),The dancer was costumed by the tailor.,-55.06492614746094,10
tensor(543),The tailor was costumed by the dancer.,-54.99985885620117,10
tensor(544),The dressmaker attired the ballerina.,-52.65675354003906,11
tensor(545),The ballerina attired the dressmaker.,-57.8333740234375,11
tensor(546),The ballerina was attired by the dressmaker.,-54.980430603027344,13
tensor(547),The dressmaker was attired by the ballerina.,-57.67708206176758,13
tensor(548),The principal scolded the child.,-40.46643829345703,8
tensor(549),The child scolded the principal.,-44.505340576171875,8
tensor(550),The child was scolded by the principal.,-40.21891784667969,10
tensor(551),The principal was scolded by the child.,-43.16751480102539,10
tensor(552),The headmaster reprimanded the kid.,-40.748653411865234,9
tensor(553),The kid reprimanded the headmaster.,-44.40687561035156,9
tensor(554),The kid was reprimanded by the headmaster.,-42.1233024597168,11
tensor(555),The headmaster was reprimanded by the kid.,-47.84367370605469,11
tensor(556),The lord named the heir.,-38.733917236328125,7
tensor(557),The heir named the lord.,-44.89167404174805,7
tensor(558),The heir was named by the lord.,-45.05503845214844,9
tensor(559),The lord was named by the heir.,-48.124961853027344,9
tensor(560),The baron chose the successor.,-46.77337646484375,8
tensor(561),The successor chose the baron.,-50.94894790649414,8
tensor(562),The successor was chosen by the baron.,-50.62055206298828,10
tensor(563),The baron was chosen by the successor.,-48.127845764160156,10
tensor(564),The cop restrained the rioter.,-41.295223236083984,8
tensor(565),The rioter restrained the cop.,-41.2164306640625,8
tensor(566),The rioter was restrained by the cop.,-41.93939971923828,10
tensor(567),The cop was restrained by the rioter.,-44.21875762939453,10
tensor(568),The policeman subdued the rabble-rouser.,-50.99869918823242,11
tensor(569),The rabble-rouser subdued the policeman.,-51.84717559814453,11
tensor(570),The rabble-rouser was subdued by the policeman.,-50.18605422973633,13
tensor(571),The policeman was subdued by the rabble-rouser.,-50.41716766357422,13
tensor(572),The dad coddled the baby.,-41.831932067871094,9
tensor(573),The baby coddled the dad.,-42.96895217895508,9
tensor(574),The baby was coddled by the dad.,-40.710758209228516,11
tensor(575),The dad was coddled by the baby.,-44.35365295410156,11
tensor(576),The father pampered the infant.,-43.395381927490234,9
tensor(577),The infant pampered the father.,-48.09291458129883,9
tensor(578),The infant was pampered by the father.,-45.64849853515625,11
tensor(579),The father was pampered by the infant.,-47.91376495361328,11
tensor(580),The king exiled the rebel.,-45.05086135864258,7
tensor(581),The rebel exiled the king.,-47.843048095703125,7
tensor(582),The rebel was exiled by the king.,-45.63674545288086,9
tensor(583),The king was exiled by the rebel.,-44.15998840332031,9
tensor(584),The monarch banished the insurgent.,-53.17954635620117,7
tensor(585),The insurgent banished the monarch.,-52.632591247558594,7
tensor(586),The insurgent was banished by the monarch.,-50.42549514770508,9
tensor(587),The monarch was banished by the insurgent.,-51.78470230102539,9
tensor(588),The thief robbed the manufacturer.,-41.81373596191406,7
tensor(589),The manufacturer robbed the thief.,-43.386619567871094,7
tensor(590),The manufacturer was robbed by the thief.,-42.76263427734375,9
tensor(591),The thief was robbed by the manufacturer.,-43.70488739013672,9
tensor(592),The robber burgled the industrialist.,-54.14813995361328,9
tensor(593),The industrialist burgled the robber.,-56.831581115722656,9
tensor(594),The industrialist was burgled by the robber.,-51.25653839111328,11
tensor(595),The robber was burgled by the industrialist.,-52.66607666015625,11
tensor(596),The pessimist discouraged the contestant.,-52.79425811767578,8
tensor(597),The contestant discouraged the pessimist.,-55.146732330322266,8
tensor(598),The contestant was discouraged by the pessimist.,-53.85844802856445,10
tensor(599),The pessimist was discouraged by the contestant.,-56.74782180786133,10
tensor(600),The cynic dissuaded the participant.,-52.97665786743164,9
tensor(601),The participant dissuaded the cynic.,-53.11316680908203,9
tensor(602),The participant was dissuaded by the cynic.,-52.02790832519531,11
tensor(603),The cynic was dissuaded by the participant.,-57.08397674560547,11
tensor(604),The loudmouth tormented the loner.,-55.53033447265625,10
tensor(605),The loner tormented the loudmouth.,-53.290287017822266,10
tensor(606),The loner was tormented by the loudmouth.,-54.261112213134766,12
tensor(607),The loudmouth was tormented by the loner.,-56.63688659667969,12
tensor(608),The windbag taunted the recluse.,-57.591270446777344,10
tensor(609),The recluse taunted the windbag.,-59.06753921508789,10
tensor(610),The recluse was taunted by the windbag.,-61.137779235839844,12
tensor(611),The windbag was taunted by the recluse.,-58.446983337402344,12
tensor(612),The imitator fooled the investigator.,-52.558109283447266,9
tensor(613),The investigator fooled the imitator.,-52.004112243652344,9
tensor(614),The investigator was fooled by the imitator.,-49.85906219482422,11
tensor(615),The imitator was fooled by the investigator.,-55.13886260986328,11
tensor(616),The impersonator conned the inspector.,-51.46894836425781,9
tensor(617),The inspector conned the impersonator.,-51.9527587890625,9
tensor(618),The inspector was conned by the impersonator.,-50.11772155761719,11
tensor(619),The impersonator was conned by the inspector.,-51.78715896606445,11
tensor(620),The boss fired the worker.,-38.32347106933594,7
tensor(621),The worker fired the boss.,-37.704429626464844,7
tensor(622),The worker was fired by the boss.,-38.85395050048828,9
tensor(623),The boss was fired by the worker.,-42.04753494262695,9
tensor(624),The pyromaniac unnerved the shopkeeper.,-53.86528396606445,12
tensor(625),The shopkeeper unnerved the pyromaniac.,-54.50432205200195,12
tensor(626),The shopkeeper was unnerved by the pyromaniac.,-54.61430740356445,14
tensor(627),The pyromaniac was unnerved by the shopkeeper.,-55.92839813232422,14
tensor(628),The arsonist alarmed the vendor.,-51.37925338745117,8
tensor(629),The vendor alarmed the arsonist.,-51.758056640625,8
tensor(630),The vendor was alarmed by the arsonist.,-53.88100051879883,10
tensor(631),The arsonist was alarmed by the vendor.,-53.38629150390625,10
tensor(632),The professional supported the beginner.,-46.330047607421875,7
tensor(633),The beginner supported the professional.,-51.1932373046875,7
tensor(634),The beginner was supported by the professional.,-48.82571029663086,9
tensor(635),The professional was supported by the beginner.,-49.430564880371094,9
tensor(636),The master encouraged the rookie.,-45.816104888916016,7
tensor(637),The rookie encouraged the master.,-49.929168701171875,7
tensor(638),The rookie was encouraged by the master.,-48.165042877197266,9
tensor(639),The master was encouraged by the rookie.,-50.085655212402344,9
tensor(640),The magician hypnotized the crowd.,-43.03945541381836,8
tensor(641),The crowd hypnotized the magician.,-44.77629470825195,8
tensor(642),The crowd was hypnotized by the magician.,-43.378517150878906,10
tensor(643),The magician was hypnotized by the crowd.,-43.22652053833008,10
tensor(644),The businessman employed the expert.,-45.17361831665039,7
tensor(645),The expert employed the businessman.,-50.99687194824219,7
tensor(646),The expert was employed by the businessman.,-47.645301818847656,9
tensor(647),The businessman was employed by the expert.,-49.52025604248047,9
tensor(648),The entrepreneur hired the specialist.,-47.806396484375,7
tensor(649),The specialist hired the entrepreneur.,-51.326263427734375,7
tensor(650),The specialist was hired by the entrepreneur.,-48.06416320800781,9
tensor(651),The entrepreneur was hired by the specialist.,-51.164031982421875,9
tensor(652),The terrorist petrified the first lady.,-52.40443420410156,9
tensor(653),The first lady petrified the terrorist.,-48.845298767089844,9
tensor(654),The first lady was petrified by the terrorist.,-48.662986755371094,11
tensor(655),The terrorist was petrified by the first lady.,-52.60310363769531,11
tensor(656),The hijacker terrified the president's wife.,-52.07342529296875,10
tensor(657),The president's wife terrified the hijacker.,-55.49756622314453,10
tensor(658),The president's wife was terrified by the hijacker.,-55.8553352355957,12
tensor(659),The hijacker was terrified by the president's wife.,-55.63001251220703,12
tensor(660),The judge praised the gold medalist.,-46.25495910644531,9
tensor(661),The gold medalist praised the judge.,-50.982154846191406,9
tensor(662),The gold medalist was praised by the judge.,-48.009735107421875,11
tensor(663),The judge was praised by the gold medalist.,-48.17501449584961,11
tensor(664),The panelist congratulated the winner.,-42.39099884033203,8
tensor(665),The winner congratulated the panelist.,-48.09840774536133,8
tensor(666),The winner was congratulated by the panelist.,-49.43007278442383,10
tensor(667),The panelist was congratulated by the winner.,-47.706878662109375,10
tensor(668),The liar emulated the victor.,-54.282772064208984,9
tensor(669),The victor emulated the liar.,-51.03705978393555,9
tensor(670),The victor was emulated by the liar.,-54.22195816040039,11
tensor(671),The liar was emulated by the victor.,-54.89632797241211,11
tensor(672),The deceiver imitated the conqueror.,-51.56626892089844,10
tensor(673),The conqueror imitated the deceiver.,-54.16777038574219,10
tensor(674),The conqueror was imitated by the deceiver.,-54.69827651977539,12
tensor(675),The deceiver was imitated by the conqueror.,-51.94585418701172,12
tensor(676),The environmentalist cautioned the tobacconist.,-60.80577087402344,11
tensor(677),The tobacconist cautioned the environmentalist.,-58.24881362915039,11
tensor(678),The tobacconist was cautioned by the environmentalist.,-58.26175308227539,13
tensor(679),The environmentalist was cautioned by the tobacconist.,-59.791080474853516,13
tensor(680),The alcoholic hassled the guest.,-49.54366683959961,9
tensor(681),The guest hassled the alcoholic.,-50.44001007080078,9
tensor(682),The guest was hassled by the alcoholic.,-52.714385986328125,11
tensor(683),The alcoholic was hassled by the guest.,-52.67531204223633,11
tensor(684),The drunk bothered the visitor.,-46.33623504638672,7
tensor(685),The visitor bothered the drunk.,-47.74526596069336,7
tensor(686),The visitor was bothered by the drunk.,-49.68350601196289,9
tensor(687),The drunk was bothered by the visitor.,-49.52648162841797,9
tensor(688),The commentator vexed the athlete.,-49.70811080932617,8
tensor(689),The athlete vexed the commentator.,-50.207366943359375,8
tensor(690),The athlete was vexed by the commentator.,-51.46281051635742,10
tensor(691),The commentator was vexed by the athlete.,-50.62590408325195,10
tensor(692),The sportscaster peeved the jock.,-57.76496124267578,11
tensor(693),The jock peeved the sportscaster.,-58.02419662475586,11
tensor(694),The jock was peeved by the sportscaster.,-61.03610610961914,13
tensor(695),The sportscaster was peeved by the jock.,-56.33930969238281,13
tensor(696),The preacher hugged the churchgoer.,-48.99232482910156,9
tensor(697),The churchgoer hugged the preacher.,-49.75034713745117,9
tensor(698),The churchgoer was hugged by the preacher.,-52.23344802856445,11
tensor(699),The preacher was hugged by the churchgoer.,-52.24561309814453,11
tensor(700),The pastor embraced the parishioner.,-46.38714599609375,9
tensor(701),The parishioner embraced the pastor.,-46.195045471191406,9
tensor(702),The parishioner was embraced by the pastor.,-46.65161895751953,11
tensor(703),The pastor was embraced by the parishioner.,-47.582672119140625,11
tensor(704),The maniac mocked the clown.,-46.954612731933594,7
tensor(705),The clown mocked the maniac.,-48.62639617919922,7
tensor(706),The clown was mocked by the maniac.,-49.81856155395508,9
tensor(707),The maniac was mocked by the clown.,-49.5051383972168,9
tensor(708),The lunatic ridiculed the jester.,-52.18731689453125,9
tensor(709),The jester ridiculed the lunatic.,-49.533966064453125,9
tensor(710),The jester was ridiculed by the lunatic.,-53.24127197265625,11
tensor(711),The lunatic was ridiculed by the jester.,-53.446861267089844,11
tensor(712),The archivist contacted the inventor.,-48.47883605957031,8
tensor(713),The inventor contacted the archivist.,-44.1014518737793,8
tensor(714),The inventor was contacted by the archivist.,-47.38988494873047,10
tensor(715),The archivist was contacted by the inventor.,-50.719425201416016,10
tensor(716),The historian approached the innovator.,-50.50228500366211,8
tensor(717),The innovator approached the historian.,-46.45391082763672,8
tensor(718),The innovator was approached by the historian.,-52.413055419921875,10
tensor(719),The historian was approached by the innovator.,-52.99071502685547,10
tensor(720),The janitor called the landscaper.,-41.54750442504883,9
tensor(721),The landscaper called the janitor.,-40.12733459472656,9
tensor(722),The landscaper was called by the janitor.,-44.689090728759766,11
tensor(723),The janitor was called by the landscaper.,-46.51511764526367,11
tensor(724),The custodian phoned the gardener.,-50.33099365234375,10
tensor(725),The gardener phoned the custodian.,-49.85356903076172,10
tensor(726),The gardener was phoned by the custodian.,-52.023597717285156,12
